{
  "protocolVersion": 1,
  "requestId": "request-1",
  "command": "trace.ingest",
  "payload": {
    "interaction": {
      "id": "interaction-1",
      "projectId": "project-1",
      "traceId": "0123456789abcdef0123456789abcdef",
      "occurredAt": "2026-09-30T12:00:00Z",
      "eventIds": ["event-1"]
    },
    "events": [{
      "projectId": "project-1",
      "traceId": "0123456789abcdef0123456789abcdef",
      "producerId": "browser-tab-4",
      "sequence": 1,
      "eventId": "event-1",
      "kind": "interaction",
      "occurredAt": "2026-09-30T12:00:00Z",
      "metadata": { "controlId": "save-button" }
    }],
    "relations": [{
      "id": "relation-1",
      "fromId": "symbol-1",
      "kind": "triggers",
      "evidenceIds": ["evidence-1"],
      "resolution": "unresolved",
      "layer": "observed"
    }]
  }
}
